{
  "schema_version": "0.1.0",
  "registry_id": "country_registry_2025_09_01_v1",
  "bookmark_id": "bookmark_global_fracture_2025_09_01",
  "generated_at": "2026-08-02",
  "countries": [
    {
      "country_id": "country_usa",
      "country_code": "USA",
      "name": "United States",
      "roster_basis": "top_80_2025_nominal_gdp",
      "gdp_rank": 1,
      "gdp_2025_usd_billions": 30767.075,
      "depth_tier": "A",
      "coverage_status": "collecting",
      "research_priority": "P1",
      "profile_path": "countries/usa/profile.json",
      "strategic_reason": null
    },
    {
      "country_id": "country_chn",
      "country_code": "CHN",
      "name": "China",
      "roster_basis": "top_80_2025_nominal_gdp",
      "gdp_rank": 2,
      "gdp_2025_usd_billions": 19626.247,
      "depth_tier": "A",
      "coverage_status": "collecting",
      "research_priority": "P1",
      "profile_path": "countries/chn/profile.json",
      "strategic_reason": null
    },
    {
      "country_id": "country_deu",
      "country_code": "DEU",
      "name": "Germany",
      "roster_basis": "top_80_2025_nominal_gdp",
      "gdp_rank": 3,
      "gdp_2025_usd_billions": 5048.059,
      "depth_tier": "B",
      "coverage_status": "shell",
      "research_priority": "P1",
      "profile_path": "countries/deu/profile.json",
      "strategic_reason": null
    },
    {
      "country_id": "country_jpn",
      "country_code": "JPN",
      "name": "Japan",
      "roster_basis": "top_80_2025_nominal_gdp",
      "gdp_rank": 4,
      "gdp_2025_usd_billions": 4435.163,
      "depth_tier": "B",
      "coverage_status": "shell",
      "research_priority": "P1",
      "profile_path": "countries/jpn/profile.json",
      "strategic_reason": null
    },
    {
      "country_id": "country_gbr",
      "country_code": "GBR",
      "name": "United Kingdom",
      "roster_basis": "top_80_2025_nominal_gdp",
      "gdp_rank": 5,
      "gdp_2025_usd_billions": 4003.022,
      "depth_tier": "B",
      "coverage_status": "shell",
      "research_priority": "P1",
      "profile_path": "countries/gbr/profile.json",
      "strategic_reason": null
    },
    {
      "country_id": "country_ind",
      "country_code": "IND",
      "name": "India",
      "roster_basis": "top_80_2025_nominal_gdp",
      "gdp_rank": 6,
      "gdp_2025_usd_billions": 3916.312,
      "depth_tier": "B",
      "coverage_status": "shell",
      "research_priority": "P1",
      "profile_path": "countries/ind/profile.json",
      "strategic_reason": null
    },
    {
      "country_id": "country_fra",
      "country_code": "FRA",
      "name": "France",
      "roster_basis": "top_80_2025_nominal_gdp",
      "gdp_rank": 7,
      "gdp_2025_usd_billions": 3368.925,
      "depth_tier": "B",
      "coverage_status": "shell",
      "research_priority": "P1",
      "profile_path": "countries/fra/profile.json",
      "strategic_reason": null
    },
    {
      "country_id": "country_rus",
      "country_code": "RUS",
      "name": "Russia",
      "roster_basis": "top_80_2025_nominal_gdp",
      "gdp_rank": 8,
      "gdp_2025_usd_billions": 2587.938,
      "depth_tier": "B",
      "coverage_status": "shell",
      "research_priority": "P1",
      "profile_path": "countries/rus/profile.json",
      "strategic_reason": null
    },
    {
      "country_id": "country_ita",
      "country_code": "ITA",
      "name": "Italy",
      "roster_basis": "top_80_2025_nominal_gdp",
      "gdp_rank": 9,
      "gdp_2025_usd_billions": 2550.111,
      "depth_tier": "B",
      "coverage_status": "shell",
      "research_priority": "P1",
      "profile_path": "countries/ita/profile.json",
      "strategic_reason": null
    },
    {
      "country_id": "country_can",
      "country_code": "CAN",
      "name": "Canada",
      "roster_basis": "top_80_2025_nominal_gdp",
      "gdp_rank": 10,
      "gdp_2025_usd_billions": 2319.9,
      "depth_tier": "B",
      "coverage_status": "shell",
      "research_priority": "P1",
      "profile_path": "countries/can/profile.json",
      "strategic_reason": null
    },
    {
      "country_id": "country_bra",
      "country_code": "BRA",
      "name": "Brazil",
      "roster_basis": "top_80_2025_nominal_gdp",
      "gdp_rank": 11,
      "gdp_2025_usd_billions": 2279.918,
      "depth_tier": "B",
      "coverage_status": "shell",
      "research_priority": "P1",
      "profile_path": "countries/bra/profile.json",
      "strategic_reason": null
    },
    {
      "country_id": "country_esp",
      "country_code": "ESP",
      "name": "Spain",
      "roster_basis": "top_80_2025_nominal_gdp",
      "gdp_rank": 12,
      "gdp_2025_usd_billions": 1903.826,
      "depth_tier": "C",
      "coverage_status": "shell",
      "research_priority": "P2",
      "profile_path": "countries/esp/profile.json",
      "strategic_reason": null
    },
    {
      "country_id": "country_kor",
      "country_code": "KOR",
      "name": "South Korea",
      "roster_basis": "top_80_2025_nominal_gdp",
      "gdp_rank": 13,
      "gdp_2025_usd_billions": 1872.375,
      "depth_tier": "B",
      "coverage_status": "shell",
      "research_priority": "P1",
      "profile_path": "countries/kor/profile.json",
      "strategic_reason": null
    },
    {
      "country_id": "country_aus",
      "country_code": "AUS",
      "name": "Australia",
      "roster_basis": "top_80_2025_nominal_gdp",
      "gdp_rank": 14,
      "gdp_2025_usd_billions": 1839.961,
      "depth_tier": "B",
      "coverage_status": "shell",
      "research_priority": "P1",
      "profile_path": "countries/aus/profile.json",
      "strategic_reason": null
    },
    {
      "country_id": "country_mex",
      "country_code": "MEX",
      "name": "Mexico",
      "roster_basis": "top_80_2025_nominal_gdp",
      "gdp_rank": 15,
      "gdp_2025_usd_billions": 1832.641,
      "depth_tier": "C",
      "coverage_status": "shell",
      "research_priority": "P2",
      "profile_path": "countries/mex/profile.json",
      "strategic_reason": null
    },
    {
      "country_id": "country_tur",
      "country_code": "TUR",
      "name": "Türkiye",
      "roster_basis": "top_80_2025_nominal_gdp",
      "gdp_rank": 16,
      "gdp_2025_usd_billions": 1597.301,
      "depth_tier": "B",
      "coverage_status": "shell",
      "research_priority": "P1",
      "profile_path": "countries/tur/profile.json",
      "strategic_reason": null
    },
    {
      "country_id": "country_idn",
      "country_code": "IDN",
      "name": "Indonesia",
      "roster_basis": "top_80_2025_nominal_gdp",
      "gdp_rank": 17,
      "gdp_2025_usd_billions": 1445.642,
      "depth_tier": "B",
      "coverage_status": "shell",
      "research_priority": "P1",
      "profile_path": "countries/idn/profile.json",
      "strategic_reason": null
    },
    {
      "country_id": "country_nld",
      "country_code": "NLD",
      "name": "Netherlands",
      "roster_basis": "top_80_2025_nominal_gdp",
      "gdp_rank": 18,
      "gdp_2025_usd_billions": 1332.24,
      "depth_tier": "C",
      "coverage_status": "shell",
      "research_priority": "P2",
      "profile_path": "countries/nld/profile.json",
      "strategic_reason": null
    },
    {
      "country_id": "country_sau",
      "country_code": "SAU",
      "name": "Saudi Arabia",
      "roster_basis": "top_80_2025_nominal_gdp",
      "gdp_rank": 19,
      "gdp_2025_usd_billions": 1276.943,
      "depth_tier": "B",
      "coverage_status": "shell",
      "research_priority": "P1",
      "profile_path": "countries/sau/profile.json",
      "strategic_reason": null
    },
    {
      "country_id": "country_che",
      "country_code": "CHE",
      "name": "Switzerland",
      "roster_basis": "top_80_2025_nominal_gdp",
      "gdp_rank": 20,
      "gdp_2025_usd_billions": 1043.544,
      "depth_tier": "C",
      "coverage_status": "shell",
      "research_priority": "P2",
      "profile_path": "countries/che/profile.json",
      "strategic_reason": null
    },
    {
      "country_id": "country_pol",
      "country_code": "POL",
      "name": "Poland",
      "roster_basis": "top_80_2025_nominal_gdp",
      "gdp_rank": 21,
      "gdp_2025_usd_billions": 1035.586,
      "depth_tier": "C",
      "coverage_status": "shell",
      "research_priority": "P2",
      "profile_path": "countries/pol/profile.json",
      "strategic_reason": null
    },
    {
      "country_id": "country_twn",
      "country_code": "TWN",
      "name": "Taiwan",
      "roster_basis": "top_80_2025_nominal_gdp",
      "gdp_rank": 22,
      "gdp_2025_usd_billions": 920.05,
      "depth_tier": "A",
      "coverage_status": "collecting",
      "research_priority": "P1",
      "profile_path": "countries/twn/profile.json",
      "strategic_reason": null
    },
    {
      "country_id": "country_bel",
      "country_code": "BEL",
      "name": "Belgium",
      "roster_basis": "top_80_2025_nominal_gdp",
      "gdp_rank": 23,
      "gdp_2025_usd_billions": 724.917,
      "depth_tier": "C",
      "coverage_status": "shell",
      "research_priority": "P2",
      "profile_path": "countries/bel/profile.json",
      "strategic_reason": null
    },
    {
      "country_id": "country_irl",
      "country_code": "IRL",
      "name": "Ireland",
      "roster_basis": "top_80_2025_nominal_gdp",
      "gdp_rank": 24,
      "gdp_2025_usd_billions": 718.14,
      "depth_tier": "C",
      "coverage_status": "shell",
      "research_priority": "P2",
      "profile_path": "countries/irl/profile.json",
      "strategic_reason": null
    },
    {
      "country_id": "country_arg",
      "country_code": "ARG",
      "name": "Argentina",
      "roster_basis": "top_80_2025_nominal_gdp",
      "gdp_rank": 25,
      "gdp_2025_usd_billions": 681.485,
      "depth_tier": "C",
      "coverage_status": "shell",
      "research_priority": "P2",
      "profile_path": "countries/arg/profile.json",
      "strategic_reason": null
    },
    {
      "country_id": "country_swe",
      "country_code": "SWE",